{
  "$schema": "https://json-schema.org/draft/2020-12/schema",
  "$id": "https://example.invalid/coding-agent-skills/review-record.schema.json",
  "title": "Code-review record",
  "type": "object",
  "required": [
    "schema_version",
    "repository",
    "pull_request",
    "review",
    "findings",
    "prior_dispositions"
  ],
  "properties": {
    "schema_version": { "const": 1 },
    "repository": { "type": "string" },
    "pull_request": {
      "type": "object",
      "required": ["number", "url", "title", "base_ref", "base_sha", "head_sha"],
      "properties": {
        "head_ref": { "description": "The pull request's head branch; absent from older records.", "type": "string", "minLength": 1 }
      }
    },
    "review": {
      "type": "object",
      "required": ["version", "mode", "reviewed_at", "summary", "verdict", "counts", "adapter"],
      "properties": {
        "coverage": {
          "description": "Changed files no reviewer saw in full. Present only when one of its lists is not empty.",
          "type": "object",
          "additionalProperties": false,
          "required": ["unavailable_sources"],
          "properties": {
            "unavailable_sources": {
              "description": "Changed files whose source the snapshot could not provide, so reviewers saw only their diff. A non-empty list makes the verdict INCOMPLETE unless findings request changes.",
              "type": "array", "items": { "type": "string", "minLength": 1 }, "uniqueItems": true
            },
            "uncovered_files": {
              "description": "Changed files no specialist covers, left unreviewed because the reviewer manifest sets uncovered to ignore. A deliberate opt-out: it does not change the verdict.",
              "type": "array", "items": { "type": "string", "minLength": 1 }, "uniqueItems": true
            }
          }
        },
        "reviewers": {
          "description": "The reviewers that ran: files covered, findings raised, reruns, and time taken.",
          "type": "array",
          "minItems": 1,
          "items": {
            "type": "object",
            "additionalProperties": false,
            "required": ["id", "category", "files", "findings", "retries", "dispositions_only"],
            "properties": {
              "id": { "type": "string", "minLength": 1 },
              "category": { "type": "string", "minLength": 1 },
              "files": { "type": "integer", "minimum": 0 },
              "findings": { "type": "integer", "minimum": 0 },
              "retries": { "type": "integer", "minimum": 0 },
              "dispositions_only": { "type": "boolean" },
              "model": {
                "description": "The model the reviewer reported running on, from its accepted result; absent for a repository entrypoint reviewer and in older records.",
                "type": "string",
                "minLength": 1,
                "maxLength": 200
              },
              "seconds": {
                "description": "Whole seconds from handing the role to a reviewer to its accepted result, reruns included; absent when the run was not timed.",
                "type": "integer",
                "minimum": 0
              }
            }
          }
        },
        "patches": {
          "description": "Each changed file's patch fingerprint, built from its added and removed lines only, so the next re-review can tell which files changed since; absent in older records.",
          "type": "object",
          "minProperties": 1,
          "additionalProperties": {
            "type": "object",
            "additionalProperties": false,
            "required": ["sha256", "lines"],
            "properties": {
              "sha256": { "type": "string", "pattern": "^[0-9a-f]{64}$" },
              "lines": { "type": "integer", "minimum": 0 }
            }
          }
        },
        "scope": {
          "description": "A re-review's scope: what was requested, what ran and why, and how much changed since the version it compared with. The changed counts are null when it could not compare.",
          "type": "object",
          "additionalProperties": false,
          "required": ["requested", "used", "reason", "since_version", "files_changed", "files_total", "lines_changed",
                       "lines_total"],
          "properties": {
            "requested": { "enum": ["auto", "full", "incremental"] },
            "used": { "enum": ["full", "incremental"] },
            "reason": { "type": "string", "minLength": 1 },
            "since_version": { "type": "integer", "minimum": 1 },
            "files_changed": { "type": ["integer", "null"], "minimum": 0 },
            "files_total": { "type": "integer", "minimum": 0 },
            "lines_changed": { "type": ["integer", "null"], "minimum": 0 },
            "lines_total": { "type": "integer", "minimum": 0 }
          }
        }
      }
    },
    "findings": {
      "type": "array",
      "items": {
        "type": "object",
        "properties": {
          "repeats": {
            "description": "Present only when the finding reports the same problem as another one, which it is counted with: a finding in this review (version equal to the record's) or the first finding of a ledger entry (an earlier version). Absent from records written before ledgers.",
            "$ref": "#/$defs/finding_reference"
          }
        }
      }
    },
    "prior_dispositions": {
      "description": "One per prior finding the review was given. In a record with a ledger, finding_id is the ledger entry's v<version>:<finding ID>; in an older record, a bare finding ID of the version it compared with.",
      "type": "array"
    },
    "ledger": {
      "description": "Every problem raised on the pull request since its latest initial review, one entry each, ordered by version and finding ID. A re-review extends the latest record's ledger; an initial review starts a fresh one. Absent from records written before ledgers, which are read as having no history.",
      "type": "array",
      "items": {
        "type": "object",
        "additionalProperties": false,
        "required": ["version", "id", "severity", "category", "state", "judged_in", "dispositions", "repeats"],
        "properties": {
          "version": { "description": "The review version where the problem first appeared.", "type": "integer", "minimum": 1 },
          "id": { "description": "Its finding ID in that version.", "type": "string", "pattern": "^F[0-9]{3,}$" },
          "severity": { "enum": ["MUST_FIX", "SHOULD_FIX", "SUGGESTION"] },
          "category": { "type": "string", "minLength": 1 },
          "state": {
            "description": "open when the latest judgment raised or repeated it or found it still_present or partially_addressed; closed when addressed or superseded; unverified when unable_to_verify. Open entries count toward the verdict.",
            "enum": ["open", "closed", "unverified"]
          },
          "judged_in": { "description": "The version that last raised, repeated, or disposed of it.", "type": "integer", "minimum": 1 },
          "dispositions": {
            "description": "Each later review's disposition of it, oldest first.",
            "type": "array",
            "items": {
              "type": "object",
              "additionalProperties": false,
              "required": ["version", "disposition"],
              "properties": {
                "version": { "type": "integer", "minimum": 2 },
                "disposition": { "enum": ["addressed", "partially_addressed", "still_present", "superseded", "unable_to_verify"] }
              }
            }
          },
          "repeats": {
            "description": "The findings linked to it as repeats, oldest first.",
            "type": "array",
            "items": { "$ref": "#/$defs/finding_reference" }
          }
        }
      }
    },
    "github_comments": {
      "description": "The open review comments the reviewers gave dispositions for, as listed in the request.",
      "type": "array",
      "minItems": 1
    },
    "comment_dispositions": { "type": "array" },
    "artifacts": {
      "type": "object",
      "required": ["payload_sha256", "markdown_sha256"]
    }
  },
  "dependentRequired": {
    "github_comments": ["comment_dispositions"],
    "comment_dispositions": ["github_comments"]
  },
  "$defs": {
    "finding_reference": {
      "type": "object",
      "additionalProperties": false,
      "required": ["version", "id"],
      "properties": {
        "version": { "type": "integer", "minimum": 1 },
        "id": { "type": "string", "pattern": "^F[0-9]{3,}$" }
      }
    }
  }
}
